{
  "$schema": "http://json-schema.org/draft-07/schema#",
  "title": "QuebecRegionsMapConfig",
  "description": "CMS-controlled configuration for the Québec administrative regions map embed.",
  "type": "object",
  "required": ["regions"],
  "additionalProperties": false,
  "properties": {
    "$schema": { "type": "string" },
    "title": { "type": "string" },
    "geoUrl": { "type": "string" },
    "view": {
      "type": "object",
      "additionalProperties": false,
      "properties": {
        "center": {
          "type": "array",
          "items": { "type": "number" },
          "minItems": 2,
          "maxItems": 2
        },
        "zoom": { "type": "number" },
        "minZoom": {
          "type": "number",
          "description": "Optional floor. Actual min zoom is computed so regions fill fitFill of the container."
        },
        "maxZoom": { "type": "number" },
        "fitFill": {
          "type": "number",
          "minimum": 0.5,
          "maximum": 0.95,
          "description": "How much of the map container the regions should occupy at max zoom-out (default 0.8)."
        },
        "maxBounds": { "type": "array" },
        "maxBoundsViscosity": { "type": "number" },
        "zoomSnap": { "type": "number" },
        "zoomDelta": { "type": "number" },
        "wheelPxPerZoomLevel": { "type": "number" }
      }
    },
    "ui": {
      "type": "object",
      "additionalProperties": false,
      "properties": {
        "showLegend": { "type": "boolean" },
        "interactive": { "type": "boolean" },
        "showMontrealInset": {
          "type": "boolean",
          "description": "Show the atlas-style Montréal / Laval inset (does not alter main map geometry)."
        }
      }
    },
    "style": {
      "type": "object",
      "additionalProperties": false,
      "properties": {
        "strokeWidth": { "type": "number" },
        "strokeDarken": {
          "type": "number",
          "description": "How much to darken fill colour for borders (0–1)."
        },
        "background": { "type": "string" },
        "pulseColor": {
          "type": "string",
          "description": "Colour for the soft noise field behind the cutout map."
        }
      }
    },
    "layout": {
      "type": "object",
      "description": "Montréal-centered ripple projection + optional manualOffsets / manualScales.",
      "additionalProperties": false,
      "properties": {
        "gap": {
          "type": "number",
          "description": "Paper-cut inset (e.g. 0.01). Set 0 for flush edges."
        },
        "ripple": {
          "type": "boolean",
          "description": "Montréal-centered size falloff (default true)."
        },
        "focusRegionId": {
          "type": "string",
          "description": "Epicentre region id (default 06 = Montréal). Centroid used when present."
        },
        "focusLon": { "type": "number" },
        "focusLat": { "type": "number" },
        "centerScale": {
          "type": "number",
          "description": "Uniform-ish scale at Montréal (e.g. 2.5)."
        },
        "edgeScaleX": {
          "type": "number",
          "description": "Horizontal scale at the eastern edge (Côte-Nord direction)."
        },
        "edgeScaleY": {
          "type": "number",
          "description": "Vertical scale at the northern edge (Nord-du-Québec)."
        },
        "northScaleX": {
          "type": "number",
          "description": "Horizontal scale when purely north of Montréal (keep width)."
        },
        "eastScaleY": {
          "type": "number",
          "description": "Vertical scale when purely east of Montréal (mild squash)."
        },
        "edgePull": {
          "type": "number",
          "description": "Centroid pull toward Montréal at the edge. Use 1 to keep geographic positions (avoids stacking)."
        },
        "focusRadiusDeg": {
          "type": "number",
          "description": "Distance (lon-corrected degrees) that reaches full edge falloff."
        },
        "placeGap": {
          "type": "number",
          "description": "AABB clearance between regions after ripple sizing."
        },
        "placeIterations": { "type": "number" },
        "homePull": {
          "type": "number",
          "description": "Soft spring toward geographic home while separating overlaps."
        },
        "globalScaleX": {
          "type": "number",
          "description": "Stretch the whole assembled map horizontally (1 = unchanged)."
        },
        "globalScaleY": {
          "type": "number",
          "description": "Stretch the whole assembled map vertically (1 = unchanged)."
        },
        "manualOffsets": {
          "type": "object",
          "description": "Per-region display offsets from drag export. dx=longitude Δ, dy=latitude Δ.",
          "additionalProperties": {
            "type": "object",
            "properties": {
              "dx": { "type": "number" },
              "dy": { "type": "number" }
            }
          }
        },
        "manualScales": {
          "type": "object",
          "description": "Extra per-region scale on top of the ripple. Prefer { sx, sy }. sy is applied about the southern edge so vertical squash keeps the bottom fixed.",
          "additionalProperties": {
            "type": "object",
            "properties": {
              "sx": { "type": "number" },
              "sy": { "type": "number" },
              "s": {
                "type": "number",
                "description": "Legacy uniform scale (applied to both axes)."
              }
            }
          }
        }
      }
    },
    "regions": {
      "type": "array",
      "minItems": 1,
      "items": {
        "type": "object",
        "required": ["id"],
        "additionalProperties": false,
        "properties": {
          "id": {
            "type": "string",
            "pattern": "^(0[1-9]|1[0-7])$"
          },
          "name": { "type": "string" },
          "shortName": {
            "type": "string",
            "description": "Optional shorter map label; defaults to name."
          },
          "color": { "type": "string" },
          "visible": { "type": "boolean" },
          "highlighted": { "type": "boolean" },
          "href": { "type": ["string", "null"] },
          "tooltip": { "type": ["string", "null"] }
        }
      }
    },
    "content": {
      "type": "object",
      "description": "Optional CMS content (also delivered via postMessage quebec-map:setContent).",
      "additionalProperties": false,
      "properties": {
        "contacts": {
          "type": "object",
          "description": "Contacts keyed by region id 01–17.",
          "additionalProperties": {
            "type": "object",
            "properties": {
              "fullName": { "type": "string" },
              "profileImg": { "type": ["string", "null"] },
              "title": { "type": ["string", "null"] },
              "body": {
                "type": ["string", "null"],
                "description": "HTML from CMS (sanitized on render)."
              }
            }
          }
        },
        "publications": {
          "type": "array",
          "items": {
            "type": "object",
            "properties": {
              "id": { "type": "string" },
              "title": { "type": "string" },
              "summary": { "type": "string" },
              "publishedAt": { "type": "number" },
              "url": { "type": "string" },
              "imageUrl": { "type": ["string", "null"] },
              "lat": { "type": ["number", "null"] },
              "lng": { "type": ["number", "null"] }
            }
          }
        }
      }
    }
  }
}
